{
  "ir_version": "1.0",
  "query_id": "cost_calib_004",
  "source": {
    "dataset_id": "tdrive",
    "entity": "trajectory"
  },
  "temporal": {
    "start_ms": 1230768000000,
    "end_ms": 1230854400000
  },
  "spatial": {
    "min_x": 439000.0,
    "min_y": 4415000.0,
    "max_x": 450000.0,
    "max_y": 4425000.0,
    "relation": "INTERSECTS",
    "boundary": "INCLUDED"
  },
  "predicates": [],
  "semantics": {
    "mode": "OBSERVED_POINT",
    "coupling": "SAME_POINT"
  },
  "result": {
    "mode": "TOP_K",
    "tie_breaker": "TID_ASC",
    "k": 5
  },
  "snapshot": {
    "manifest_id": "tdrive_v1_ready",
    "semantics_version": "point_similarity_v2"
  },
  "similarity": {
    "metric": "HAUSDORFF",
    "reference_tid": 1,
    "scope": "FULL_TRAJECTORY",
    "exclude_reference": true,
    "local_distance": "EUCLIDEAN",
    "normalization": "NONE"
  }
}