{
  "ir_version": "1.0",
  "query_id": "h_s_small",
  "source": {
    "dataset_id": "tdrive_v1",
    "entity": "trajectory"
  },
  "spatial": {
    "min_x": 469579.38867069356,
    "min_y": 4441898.001095969,
    "max_x": 471179.38867069356,
    "max_y": 4443498.001095969,
    "relation": "INTERSECTS",
    "boundary": "INCLUDED"
  },
  "predicates": [
    {
      "field": "vehicle_id",
      "op": "EQ",
      "value": "8857"
    }
  ],
  "semantics": {
    "mode": "OBSERVED_POINT",
    "coupling": "SAME_POINT"
  },
  "result": {
    "mode": "TRAJECTORY_IDS",
    "tie_breaker": "TID_ASC"
  },
  "snapshot": {
    "manifest_id": "tdrive_v1_ready",
    "semantics_version": "point_dtw_v1"
  }
}